{
  "human_metadata_graph_version": "0.1.0",
  "generated_at": "2026-07-04T12:00:00Z",
  "subject": {
    "id": "human:kirk_evan_brown",
    "preferred_display": "Capt",
    "privacy_level": "private",
    "consent_scope": ["symbolic_analysis", "identity_graph", "project_alignment"]
  },
  "nodes": [
    {
      "id": "human:kirk_evan_brown",
      "label": "Kirk Evan Brown",
      "type": "HUMAN",
      "original_text": "Kirk Evan Brown",
      "normalized_text": "KIRKEVANBROWN",
      "created_from": "user_confirmed",
      "source": "birth_certificate",
      "confidence": 1.0,
      "provenance": "user_confirmed",
      "created_at": "2026-07-04T12:00:00Z",
      "updated_at": "2026-07-04T12:00:00Z",
      "is_user_confirmed": true,
      "is_symbolic": false,
      "is_measured": false,
      "is_inferred": false,
      "notes": "Birth name, legal identity"
    },
    {
      "id": "identity:birth:kirk_evan_brown",
      "label": "Kirk Evan Brown",
      "type": "BIRTH_NAME",
      "original_text": "Kirk Evan Brown",
      "normalized_text": "KIRKEVANBROWN",
      "created_from": "user_confirmed",
      "source": "birth_certificate",
      "confidence": 1.0,
      "provenance": "user_confirmed",
      "created_at": "2026-07-04T12:00:00Z",
      "updated_at": "2026-07-04T12:00:00Z",
      "is_user_confirmed": true,
      "is_symbolic": false,
      "is_measured": false,
      "is_inferred": false,
      "notes": "Legal birth name"
    },
    {
      "id": "identity:alias:capt",
      "label": "Capt",
      "type": "NICKNAME",
      "original_text": "Capt",
      "normalized_text": "CAPT",
      "created_from": "user_confirmed",
      "source": "user_declaration",
      "confidence": 1.0,
      "provenance": "user_confirmed",
      "created_at": "2026-07-04T12:00:00Z",
      "updated_at": "2026-07-04T12:00:00Z",
      "is_user_confirmed": true,
      "is_symbolic": false,
      "is_measured": false,
      "is_inferred": false,
      "notes": "Compressed command identity"
    },
    {
      "id": "identity:alias:captain",
      "label": "Captain",
      "type": "NICKNAME",
      "original_text": "Captain",
      "normalized_text": "CAPTAIN",
      "created_from": "user_confirmed",
      "source": "user_declaration",
      "confidence": 1.0,
      "provenance": "user_confirmed",
      "created_at": "2026-07-04T12:00:00Z",
      "updated_at": "2026-07-04T12:00:00Z",
      "is_user_confirmed": true,
      "is_symbolic": false,
      "is_measured": false,
      "is_inferred": false,
      "notes": "Archetypal navigator identity"
    },
    {
      "id": "identity:handle:knowurknot",
      "label": "Knowurknot",
      "type": "HANDLE",
      "original_text": "Knowurknot",
      "normalized_text": "KNOWURKNOT",
      "created_from": "user_confirmed",
      "source": "user_declaration",
      "confidence": 1.0,
      "provenance": "user_confirmed",
      "created_at": "2026-07-04T12:00:00Z",
      "updated_at": "2026-07-04T12:00:00Z",
      "is_user_confirmed": true,
      "is_symbolic": true,
      "is_measured": false,
      "is_inferred": false,
      "notes": "Paradox key handle, contains know/unknown/knot/not"
    },
    {
      "id": "identity:persona:captain_knowurknot",
      "label": "Captain Knowurknot",
      "type": "PUBLIC_PERSONA",
      "original_text": "Captain Knowurknot",
      "normalized_text": "CAPTAINKNOWURKNOT",
      "created_from": "user_confirmed",
      "source": "user_declaration",
      "confidence": 1.0,
      "provenance": "user_confirmed",
      "created_at": "2026-07-04T12:00:00Z",
      "updated_at": "2026-07-04T12:00:00Z",
      "is_user_confirmed": true,
      "is_symbolic": true,
      "is_measured": false,
      "is_inferred": false,
      "notes": "Public myth-node, navigator of knots"
    },
    {
      "id": "identity:handle:knowurknottty",
      "label": "knowurknottty",
      "type": "HANDLE",
      "original_text": "knowurknottty",
      "normalized_text": "KNOWURKNOTTTY",
      "created_from": "user_confirmed",
      "source": "user_declaration",
      "confidence": 1.0,
      "provenance": "user_confirmed",
      "created_at": "2026-07-04T12:00:00Z",
      "updated_at": "2026-07-04T12:00:00Z",
      "is_user_confirmed": true,
      "is_symbolic": true,
      "is_measured": false,
      "is_inferred": false,
      "notes": "Variant handle with double-y"
    },
    {
      "id": "identity:alias:jenn",
      "label": "Jenn",
      "type": "NICKNAME",
      "original_text": "Jenn",
      "normalized_text": "JENN",
      "created_from": "user_confirmed",
      "source": "user_declaration",
      "confidence": 1.0,
      "provenance": "user_confirmed",
      "created_at": "2026-07-04T12:00:00Z",
      "updated_at": "2026-07-04T12:00:00Z",
      "is_user_confirmed": true,
      "is_symbolic": false,
      "is_measured": false,
      "is_inferred": false,
      "notes": "Partner's name, also project namesake"
    },
    {
      "id": "project:capt",
      "label": "CAPT",
      "type": "PROJECT",
      "original_text": "CAPT",
      "normalized_text": "CAPT",
      "created_from": "user_confirmed",
      "source": "project_definition",
      "confidence": 1.0,
      "provenance": "user_confirmed",
      "created_at": "2026-07-04T12:00:00Z",
      "updated_at": "2026-07-04T12:00:00Z",
      "is_user_confirmed": true,
      "is_symbolic": true,
      "is_measured": false,
      "is_inferred": false,
      "notes": "Cognitive Architecture Processing Technology"
    },
    {
      "id": "project:biocapt",
      "label": "bioCAPT",
      "type": "PROJECT",
      "original_text": "bioCAPT",
      "normalized_text": "BIOCAPT",
      "created_from": "user_confirmed",
      "source": "project_definition",
      "confidence": 1.0,
      "provenance": "user_confirmed",
      "created_at": "2026-07-04T12:00:00Z",
      "updated_at": "2026-07-04T12:00:00Z",
      "is_user_confirmed": true,
      "is_symbolic": true,
      "is_measured": false,
      "is_inferred": false,
      "notes": "Embodied biosignal intelligence layer"
    },
    {
      "id": "project:frankencapt",
      "label": "FrankenCAPT",
      "type": "PROJECT",
      "original_text": "FrankenCAPT",
      "normalized_text": "FRANKENCAPT",
      "created_from": "user_confirmed",
      "source": "project_definition",
      "confidence": 1.0,
      "provenance": "user_confirmed",
      "created_at": "2026-07-04T12:00:00Z",
      "updated_at": "2026-07-04T12:00:00Z",
      "is_user_confirmed": true,
      "is_symbolic": true,
      "is_measured": false,
      "is_inferred": false,
      "notes": "Stitched hybrid synthesis"
    },
    {
      "id": "project:jennai",
      "label": "Jenn-ai",
      "type": "PROJECT",
      "original_text": "Jenn-ai",
      "normalized_text": "JENNAI",
      "created_from": "user_confirmed",
      "source": "project_definition",
      "confidence": 1.0,
      "provenance": "user_confirmed",
      "created_at": "2026-07-04T12:00:00Z",
      "updated_at": "2026-07-04T12:00:00Z",
      "is_user_confirmed": true,
      "is_symbolic": true,
      "is_measured": false,
      "is_inferred": false,
      "notes": "Pragmatic executive agent for partner"
    },
    {
      "id": "project:synsync",
      "label": "SynSync",
      "type": "PROJECT",
      "original_text": "SynSync",
      "normalized_text": "SYNSYNC",
      "created_from": "user_confirmed",
      "source": "project_definition",
      "confidence": 1.0,
      "provenance": "user_confirmed",
      "created_at": "2026-07-04T12:00:00Z",
      "updated_at": "2026-07-04T12:00:00Z",
      "is_user_confirmed": true,
      "is_symbolic": true,
      "is_measured": false,
      "is_inferred": false,
      "notes": "Nervous-system resonance synchronization"
    },
    {
      "id": "project:inversion_labs",
      "label": "Inversion Labs",
      "type": "BRAND",
      "original_text": "Inversion Labs",
      "normalized_text": "INVERSIONLABS",
      "created_from": "user_confirmed",
      "source": "project_definition",
      "confidence": 1.0,
      "provenance": "user_confirmed",
      "created_at": "2026-07-04T12:00:00Z",
      "updated_at": "2026-07-04T12:00:00Z",
      "is_user_confirmed": true,
      "is_symbolic": true,
      "is_measured": false,
      "is_inferred": false,
      "notes": "Ethical metasystem container"
    },
    {
      "id": "project:knowledge_bubbles",
      "label": "Knowledge Bubbles",
      "type": "PROJECT",
      "original_text": "Knowledge Bubbles",
      "normalized_text": "KNOWLEDGEBUBBLES",
      "created_from": "user_confirmed",
      "source": "project_definition",
      "confidence": 1.0,
      "provenance": "user_confirmed",
      "created_at": "2026-07-04T12:00:00Z",
      "updated_at": "2026-07-04T12:00:00Z",
      "is_user_confirmed": true,
      "is_symbolic": true,
      "is_measured": false,
      "is_inferred": false,
      "notes": "Knowledge mining and token economy"
    },
    {
      "id": "project:soul_fractal_engine",
      "label": "Soul Fractal Engine",
      "type": "PROJECT",
      "original_text": "Soul Fractal Engine",
      "normalized_text": "SOULFRACTALENGINE",
      "created_from": "user_confirmed",
      "source": "project_definition",
      "confidence": 1.0,
      "provenance": "user_confirmed",
      "created_at": "2026-07-04T12:00:00Z",
      "updated_at": "2026-07-04T12:00:00Z",
      "is_user_confirmed": true,
      "is_symbolic": true,
      "is_measured": false,
      "is_inferred": false,
      "notes": "Recursive identity/soul architecture"
    },
    {
      "id": "project:wyrd",
      "label": "Wyrd",
      "type": "PROJECT",
      "original_text": "Wyrd",
      "normalized_text": "WYRD",
      "created_from": "user_confirmed",
      "source": "project_definition",
      "confidence": 1.0,
      "provenance": "user_confirmed",
      "created_at": "2026-07-04T12:00:00Z",
      "updated_at": "2026-07-04T12:00:00Z",
      "is_user_confirmed": true,
      "is_symbolic": true,